{
  "id": "listicle-text-overlay",
  "name": "Listicle / text-overlay education",
  "platforms": ["meta", "tiktok", "linkedin", "organic_short"],
  "style": "listicle_text_overlay",
  "funnel_stage": "mof_consideration",
  "niches": ["saas", "finance", "health", "auto", "home", "b2b"],
  "duration_seconds": { "min": 20, "max": 60, "ideal": 35 },
  "aspect_ratios": ["9:16", "1:1"],
  "hook": {
    "window_seconds": "0-3",
    "visual": "Static or slow B-roll under huge title card",
    "audio_or_vo": "‘N mistakes / signs / steps…’ with a surprising N or niche",
    "text_overlay": "The list title — must be readable muted",
    "pattern_interrupt": "Specific number + specific audience"
  },
  "body": {
    "beats": [
      {
        "t": "3-28s",
        "purpose": "Deliver 3–5 items",
        "visual": "Each item gets its own card + supporting visual",
        "vo_or_copy": "One insight per item; no filler"
      },
      {
        "t": "28-35s",
        "purpose": "Bridge to offer as item N+1 or summary",
        "visual": "Brand/solution card",
        "vo_or_copy": "If you’re making these mistakes, here’s the fix path"
      }
    ]
  },
  "cta": {
    "type": "learn_more",
    "on_screen": "Full checklist / Free guide / Learn more",
    "spoken_or_caption": "Save this · Link for the full list",
    "landing_promise": "Checklist or article that expands the same N items"
  },
  "audio_design": {
    "music_energy": "Steady educational bed",
    "vo_pace": "Clear teacher pace",
    "captions": "Item numbers always on screen"
  },
  "visual_system": {
    "camera": "Simple B-roll or screen recording",
    "lighting": "Clean",
    "color": "High-contrast text cards",
    "editing_pace": "One idea per cut",
    "text_style": "Large numbered cards; brand-safe margins"
  },
  "why_it_works": [
    "Saves and shares from checklist value",
    "Works muted",
    "Positions brand as educator before seller"
  ],
  "anti_patterns": [
    "Vague items that aren’t actionable",
    "Too many items for the runtime",
    "Hard sell on item 1"
  ],
  "metrics_signals": [
    "Saves",
    "Shares",
    "Landing page scroll depth on the checklist"
  ],
  "prompt_seeds": {
    "script": "35s ‘5 mistakes’ listicle for [niche]. Specific audience in title. Each item actionable. Soft CTA to full checklist."
  },
  "output_contract": {
    "deliverables": ["script", "caption_track", "primary_text", "headline"]
  },
  "source_notes": "Education-led mid-funnel pattern."
}
