{
  "id": "meme-native-trend",
  "name": "Meme / native trend hijack",
  "platforms": ["tiktok", "meta", "organic_short"],
  "style": "meme_native",
  "funnel_stage": "tof_awareness",
  "niches": ["consumer", "ecommerce", "saas", "youth", "food"],
  "duration_seconds": { "min": 6, "max": 20, "ideal": 12 },
  "aspect_ratios": ["9:16"],
  "hook": {
    "window_seconds": "0-1.5",
    "visual": "Trend format recognized in first beat (duet layout, green screen, POV, capcut template)",
    "audio_or_vo": "Use the trend audio OR the trend cadence with original words",
    "text_overlay": "Trend-native text placement",
    "pattern_interrupt": "The format itself is the interrupt — don’t add a second gimmick"
  },
  "body": {
    "beats": [
      {
        "t": "1.5-7s",
        "purpose": "Deliver the punchline that maps to the product job",
        "visual": "Stay inside the template; swap only the payload",
        "vo_or_copy": "One joke → one product truth"
      },
      {
        "t": "7-12s",
        "purpose": "Soft brand land",
        "visual": "Quick product insert or end text",
        "vo_or_copy": "Optional; sometimes the comment CTA is enough"
      }
    ]
  },
  "cta": {
    "type": "dm_keyword",
    "on_screen": "Comment KEYWORD / link in bio",
    "spoken_or_caption": "Comment [WORD] and I’ll send…",
    "landing_promise": "DM automation or bio link matches the joke’s promise"
  },
  "audio_design": {
    "music_energy": "Trend audio when licensed/allowed; else recreate cadence",
    "vo_pace": "Match native creators on that sound",
    "captions": "Native caption style"
  },
  "visual_system": {
    "camera": "Whatever the trend demands",
    "lighting": "Native",
    "color": "Native",
    "editing_pace": "Trend-timed cuts",
    "text_style": "Platform default meme typography"
  },
  "why_it_works": [
    "Borrowed attention from existing cultural moment",
    "Feels like content, not ads — higher completion on cold",
    "Cheap to iterate while a sound is hot"
  ],
  "anti_patterns": [
    "Forcing a trend that doesn’t map to the offer",
    "Late brand dumps that kill the joke",
    "Using audio you don’t have rights to in paid placements"
  ],
  "metrics_signals": [
    "Spike in organic shares during trend window",
    "Comment volume",
    "Follow rate"
  ],
  "prompt_seeds": {
    "script": "12s trend hijack. Stay in format. One punchline = one product truth. Soft CTA.",
    "video_gen": "Vertical native meme-style clip matching [trend format], no corporate polish"
  },
  "output_contract": {
    "deliverables": ["script", "caption_track", "cta_variants", "ab_test_matrix"]
  },
  "source_notes": "Ephemeral pattern — refresh weekly; do not bake specific trending sounds into the skill forever."
}
