{
  "id": "social-proof-stack",
  "name": "Social proof stack (reviews → result → offer)",
  "platforms": ["meta", "youtube", "google_display"],
  "style": "social_proof_stack",
  "funnel_stage": "bof_conversion",
  "niches": ["local_services", "ecommerce", "saas", "auto", "home"],
  "duration_seconds": { "min": 15, "max": 45, "ideal": 25 },
  "aspect_ratios": ["4:5", "1:1", "9:16"],
  "hook": {
    "window_seconds": "0-3",
    "visual": "Real review UI or customer face — not stock smile",
    "audio_or_vo": "Customer’s strongest sentence, unedited if possible",
    "text_overlay": "Star rating + truncated quote",
    "pattern_interrupt": "Lead with proof, not the offer"
  },
  "body": {
    "beats": [
      {
        "t": "3-12s",
        "purpose": "Stack 2–3 proof units",
        "visual": "Cut between review cards, photos, short clips",
        "vo_or_copy": "Different proof types: outcome, process, personality"
      },
      {
        "t": "12-18s",
        "purpose": "Bridge to offer",
        "visual": "Product/service in use or shop exterior",
        "vo_or_copy": "Who it’s for + the primary outcome"
      },
      {
        "t": "18-25s",
        "purpose": "Risk reversal",
        "visual": "Guarantee, process clarity, or ‘what happens next’",
        "vo_or_copy": "Remove the biggest objection in one line"
      }
    ]
  },
  "cta": {
    "type": "direct_offer",
    "on_screen": "Get quote / Shop / Start free",
    "spoken_or_caption": "Join the [N] people who… / Book your slot",
    "landing_promise": "Reviews visible near the form; same proof language"
  },
  "audio_design": {
    "music_energy": "Warm, steady; don’t overpower customer VO",
    "vo_pace": "Customer natural; brand VO clear and brief",
    "captions": "Quote text must match audio"
  },
  "visual_system": {
    "camera": "Mix of screen recordings of real reviews + authentic clips",
    "lighting": "Whatever the customer shot in — authenticity > polish",
    "color": "Brand accents only on end card",
    "editing_pace": "Medium; give each proof 2–4s",
    "text_style": "Quote cards readable on mobile"
  },
  "why_it_works": [
    "Proof-first lowers skepticism on warm/retarget traffic",
    "Varied proof types cover different objections",
    "Risk reversal closes the loop"
  ],
  "anti_patterns": [
    "Invented testimonials",
    "Only 5-star fluff with no specifics",
    "Illegible review screenshots"
  ],
  "metrics_signals": [
    "High conversion rate on retargeting",
    "Form starts after proof beats",
    "Lower CPA vs creative-only ads"
  ],
  "prompt_seeds": {
    "script": "25s proof-first ad using 3 real review beats, then offer + objection killer. No fake quotes.",
    "shot_list": "Review1 → Review2 → Result photo → Offer → Risk reversal CTA"
  },
  "output_contract": {
    "deliverables": ["script", "primary_text", "headline", "cta_variants", "ab_test_matrix"]
  },
  "source_notes": "Bottom-of-funnel pattern; requires real reviews the brand owns rights to use."
}
