{
  "id": "pas-pain-stack",
  "name": "Problem → Agitate → Solve (pain stack)",
  "platforms": ["meta", "tiktok", "youtube"],
  "style": "problem_agitate_solve",
  "funnel_stage": "mof_consideration",
  "niches": ["local_services", "b2b", "home", "auto", "health", "finance"],
  "duration_seconds": { "min": 20, "max": 60, "ideal": 35 },
  "aspect_ratios": ["9:16", "1:1", "16:9"],
  "hook": {
    "window_seconds": "0-3",
    "visual": "The problem in progress — not the happy ending",
    "audio_or_vo": "Name the costly mistake or delay in one sentence",
    "text_overlay": "The costly outcome, not the product name",
    "pattern_interrupt": "Show consequence first (rust, downtime, invoice, empty bay)"
  },
  "body": {
    "beats": [
      {
        "t": "3-10s",
        "purpose": "Agitate with second-order costs",
        "visual": "Cut between 2–3 consequence shots",
        "vo_or_copy": "Time, money, reputation, safety — pick two and make them vivid"
      },
      {
        "t": "10-22s",
        "purpose": "Reframe the real cause",
        "visual": "Expert or process shot that reveals the hidden cause",
        "vo_or_copy": "Most people treat the symptom; the real issue is X"
      },
      {
        "t": "22-30s",
        "purpose": "Solve with a clear process",
        "visual": "3-step process or workshop sequence",
        "vo_or_copy": "Here’s the correct sequence — short, numbered, memorable"
      }
    ]
  },
  "cta": {
    "type": "book_call",
    "on_screen": "Book a diagnosis / free assessment / quote",
    "spoken_or_caption": "If you’re dealing with [problem], start with [low-friction step]",
    "landing_promise": "Same problem language in headline; form asks for the painful detail"
  },
  "audio_design": {
    "music_energy": "Tension bed under agitation; resolve on the solution beat",
    "vo_pace": "Slightly urgent until solution, then calm and clear",
    "captions": "Emphasize cost words and the 3-step labels"
  },
  "visual_system": {
    "camera": "Documentary handheld + locked process shots",
    "lighting": "Honest workshop / office light; avoid fake gloom",
    "color": "Desaturate problem; warmer solve",
    "editing_pace": "Faster cuts in agitation; slower in process",
    "text_style": "Numbered steps large enough to read muted"
  },
  "why_it_works": [
    "Agitation creates urgency without fake scarcity",
    "Cause-reframe positions expertise before the offer",
    "Numbered process is memorable and screenshot-friendly"
  ],
  "anti_patterns": [
    "Fear-mongering without a credible fix",
    "Jumping to CTA before the process is clear",
    "Generic ‘we care about quality’ claims"
  ],
  "metrics_signals": [
    "High outbound CTR on problem-matched audiences",
    "Qualified lead form answers that restate the agitation",
    "Watch time past the reframe beat"
  ],
  "prompt_seeds": {
    "script": "35s PAS ad. Open on consequence. Agitate with two second-order costs. Reframe cause. Deliver 3-step process. CTA = book diagnosis.",
    "shot_list": "Consequence → cost montage → expert reframe → step1/2/3 → CTA card",
    "image_gen": "Documentary still of the problem consequence in a real workspace, no text, no logo"
  },
  "output_contract": {
    "deliverables": ["script", "shot_list", "primary_text", "headline", "cta_variants"]
  },
  "source_notes": "Classic direct-response structure adapted for short video; pattern only."
}
