{
  "id": "cinematic-brand-spot",
  "name": "Cinematic brand spot (feeling → product)",
  "platforms": ["youtube", "meta", "organic_short"],
  "style": "cinematic_brand",
  "funnel_stage": "tof_awareness",
  "niches": ["luxury", "auto", "travel", "fashion", "craft"],
  "duration_seconds": { "min": 15, "max": 60, "ideal": 30 },
  "aspect_ratios": ["16:9", "9:16", "1:1"],
  "hook": {
    "window_seconds": "0-3",
    "visual": "One unforgettable image — motion, light, material",
    "audio_or_vo": "Score-led; VO optional and late",
    "text_overlay": "None in first 3s if the image is strong",
    "pattern_interrupt": "Beauty or tension that doesn’t look like a feed ad"
  },
  "body": {
    "beats": [
      {
        "t": "3-18s",
        "purpose": "Mood world-building",
        "visual": "3–6 crafted shots with consistent grade and lens language",
        "vo_or_copy": "Sparse poetic line or silence"
      },
      {
        "t": "18-26s",
        "purpose": "Product/craft reveal",
        "visual": "Hero object or process with same cinematic language",
        "vo_or_copy": "Brand line"
      },
      {
        "t": "26-30s",
        "purpose": "Signature end",
        "visual": "Logo / wordmark on designed plate",
        "vo_or_copy": "Tagline"
      }
    ]
  },
  "cta": {
    "type": "soft_curiosity",
    "on_screen": "Explore / Discover / Visit",
    "spoken_or_caption": "Optional",
    "landing_promise": "Brand experience page, not a hard form first"
  },
  "audio_design": {
    "music_energy": "Custom or licensed score; intentional dynamics",
    "vo_pace": "Slow if used",
    "captions": "Minimal"
  },
  "visual_system": {
    "camera": "Locked-off or motivated moves; shallow DOF; anamorphic optional",
    "lighting": "Motivated cinematic lighting",
    "color": "Unified LUT / grade",
    "editing_pace": "Breathing room; match cuts on motion",
    "text_style": "Editorial typography at end only"
  },
  "why_it_works": [
    "Builds brand memory for premium categories",
    "Performs as organic + paid for storytelling brands",
    "Differentiates from UGC-saturated auctions when targeting is warm"
  ],
  "anti_patterns": [
    "Using cinematic style for a hard direct-response offer without proof",
    "Inconsistent grade that breaks the spell",
    "Cluttered first frame"
  ],
  "metrics_signals": [
    "Brand lift / assisted conversions",
    "High completion on whitelisted placements",
    "Site engagement quality over raw CTR"
  ],
  "prompt_seeds": {
    "script": "30s cinematic brand spot. Image-led hook. Mood world. Craft reveal. Soft end card.",
    "video_gen": "Cinematic shallow-DOF sequence, unified color grade, premium materials, no UI text overlays in first seconds"
  },
  "output_contract": {
    "deliverables": ["shot_list", "video_gen_prompt", "primary_text", "thumbnail_prompt"]
  },
  "source_notes": "Brand/TOFU pattern — not a substitute for DR creative in tight CAC accounts."
}
